question	answer
9.4重大器官移	重大器官移植术，指因相应器官功能衰竭，已经实施了肾脏、肝脏、心脏或肺脏的异体植术或造血移植手术。造血干细胞移植术，指因造血功能损害或造血系统恶性肿瘤，已经实施了造血干细胞（包干细胞移植术括骨髓造血干细胞、外周血造血干细胞和脐血造血干细胞）的异体移植手术。
9.5冠状动脉搭	指为治疗严重的冠心病，实际实施了开胸进行的冠状动脉血管旁路移植的手术。桥术（或称冠状动脉支架植入术、心导管球囊扩张术、激光射频技术及其他非开胸的介入冠状动脉旁手术、腔镜手术不在保障范围内。路移植术）
9.6终末期肾病	指双肾功能慢性不可逆性衰竭，达到尿毒症期，经诊断后已经进行了至少90日的规律性（或称慢性透析治疗或实施了肾脏移植手术。肾功能衰竭尿毒症期）
9.7多个肢体缺	指因疾病或意外伤害导致两个或两个以上肢体自腕关节或踝关节近端（靠近躯干端）以失上完全性断离。
9.8急性或亚急	指因肝炎病毒感染引起肝脏组织弥漫性坏死，导致急性肝功能衰竭，且经血清学或病毒性重症肝炎学检查证实，并须满足下列全部条件：（1）重度黄疸或黄疸迅速加重；（2）肝性脑病；（3）B超或其他影像学检查显示肝脏体积急速萎缩；（4）肝功能指标进行性恶化。9.9良性脑肿瘤指脑的良性肿瘤，已经引起颅内压增高，临床表现为视神经乳头水肿、精神症状、癫痫及运动感觉障碍等，并危及生命。须由头颅断层扫描（CT）、核磁共振检查（MRI）或正电子发射断层扫描（PET）等影像学检查证实，并须满足下列至少一项条件：（1）实际实施了开颅进行的脑肿瘤完全切除或部分切除的手术；（2）实际实施了对脑肿瘤进行的放射治疗。脑垂体瘤、脑囊肿、脑血管性疾病不在保障范围内。
9.10慢性肝功	指因慢性肝脏疾病导致肝功能衰竭，须满足下列全部条件：能衰竭失代（1）持续性黄疸；偿期（2）腹水；（3）肝性脑病；（4）充血性脾肿大伴脾功能亢进或食管胃底静脉曲张。因酗酒或药物滥用导致的肝功能衰竭不在保障范围内。
9.11脑炎后遗	指因患脑炎或脑膜炎导致的神经系统永久性的功能障碍。神经系统永久性的功能障碍，症或脑膜炎指疾病确诊180天后，仍残留下列一种或一种以上障碍：后遗症（1）一肢或一肢以上肢体机能完全丧失；（2）语言能力或咀嚼吞咽能力完全丧失；（3）自主生活能力完全丧失，无法独立完成六项基本日常生活活动中的三项或三项以上。
9.12深度昏迷	指因疾病或意外伤害导致意识丧失,对外界刺激和体内需求均无反应,昏迷程度按照格拉斯哥昏迷分级（Glasgowcomascale）结果为5分或5分以下，且已经持续使用呼吸机及其它生命维持系统96小时以上。因酗酒或药物滥用导致的深度昏迷不在保障范围内。
9.13双耳失聪	指因疾病或意外伤害导致双耳听力永久不可逆性丧失，在500赫兹、1000赫兹和2000三周岁始赫兹语音频率下，平均听阈大于90分贝，且经纯音听力测试、声导抗检测或听觉诱发电理赔位检测等证实。被保险人申请理赔时年龄必须在三周岁以上，并且提供理赔当时的听力丧失诊断及检查证据。
9.14双目失明	指因疾病或意外伤害导致双眼视力永久不可逆性丧失，双眼中较好眼须满足下列至少一三周岁始项条件：理赔（1）眼球缺失或摘除；（2）矫正视力低于0.02（采用国际标准视力表，如果使用其他视力表应进行换算）；（3）视野半径小于5度。被保险人申请理赔时年龄必须在三周岁以上，并且提供理赔当时的视力丧失诊断及检查证据。
9.15瘫痪	指因疾病或意外伤害导致两肢或两肢以上肢体机能永久完全丧失。肢体机能永久完全丧失，指疾病确诊180天后或意外伤害发生180天后，每肢三大关节中的两大关节仍然完全僵硬，或不能随意识活动。
9.16心脏瓣膜	指为治疗心脏瓣膜疾病，实际实施了开胸进行的心脏瓣膜置换或修复的手术。手术
9.17严重阿尔	指因大脑进行性、不可逆性改变导致智能严重衰退或丧失，临床表现为明显的认知能力茨海默病障碍、行为异常和社交能力减退，其日常生活必须持续受到他人监护。须由头颅断层扫描（CT）、核磁共振检查（MRI）或正电子发射断层扫描（PET）等影像学检查证实，且自主生活能力完全丧失，无法独立完成六项基本日常生活活动中的三项或三项以上。神经官能症和精神疾病不在保障范围内。
9.18严重脑损	指因头部遭受机械性外力，引起脑重要部位损伤，导致神经系统永久性的功能障碍。须伤由头颅断层扫描（CT）、核磁共振检查（MRI）或正电子发射断层扫描（PET）等影像学检查证实。神经系统永久性的功能障碍，指脑损伤180天后，仍遗留下列一种或一种以上障碍：（1）一肢或一肢以上肢体机能完全丧失；（2）语言能力或咀嚼吞咽能力完全丧失；（3）自主生活能力完全丧失，无法独立完成六项基本日常生活活动中的三项或三项以上。
9.19严重帕金	是一种中枢神经系统的退行性疾病，临床表现为震颤麻痹、共济失调等。须满足下列全森病部条件：（1）药物治疗无法控制病情；（2）自主生活能力完全丧失，无法独立完成六项基本日常生活活动中的三项或三项以上。继发性帕金森综合征不在保障范围内。
9.20严重III度	指烧伤程度为度，且度烧伤面积达到全身体表面积的20或20以上。体表面积根烧伤据中国新九分法计算。
9.21严重原发	指不明原因的肺动脉压力持续性增高，进行性发展而导致的慢性疾病，已经造成永久不可逆性的体力活动能力受限，达到美国纽约心脏病学会心功能状态分级IV级，且静息状性肺动脉高压态下肺动脉平均压超过30mmHg。
9.22严重运动	是一组中枢神经系统运动神经元的进行性变性疾病，包括进行性脊肌萎缩症、进行性延神经元病髓麻痹症、原发性侧索硬化症、肌萎缩性侧索硬化症。须满足自主生活能力完全丧失，无法独立完成六项基本日常生活活动中的三项或三项以上的条件。
9.23语言能力	指因疾病或意外伤害导致完全丧失语言能力，经过积极治疗至少12个月（声带完全切除丧失三不受此时间限制），仍无法通过现有医疗手段恢复。岁始理赔精神心理因素所致的语言能力丧失不在保障范围内。被保险人申请理赔时年龄必须在三周岁以上，并且提供理赔当时的语言能力丧失诊断及检查证据。
9.24重型再生	指因骨髓造血功能慢性持续性衰竭导致的贫血、中性粒细胞减少及血小板减少。须满足下列全部条件：障碍性贫血（1）骨髓穿刺检查或骨髓活检结果支持诊断；（2）外周血象必须具备以下三项条件：中性粒细胞绝对值0.5109/L；网织红细胞1；血小板绝对值20109/L。
9.25主动脉手	指为治疗主动脉疾病，实际实施了开胸或开腹进行的切除、置换、修补病损主动脉血管术的手术。主动脉指胸主动脉和腹主动脉，不包括胸主动脉和腹主动脉的分支血管。动脉内血管成形术不在保障范围内。
9.26慢性呼吸	慢性肺部疾病导致永久不可逆性的慢性呼吸功能衰竭。慢性呼吸功能衰竭必须明确诊断功能衰竭并满足下列全部条件：（1）休息时出现呼吸困难；（2）动脉血氧分压（PaO2）50mmHg；（3）动脉血氧饱和度（SaO2）80；（4）因缺氧必须接受持续的输氧治疗。
9.27严重多发	多发性硬化为中枢神经系统白质多灶性脱髓鞘病变，病变有时累及灰质。多发性硬化必性硬化须明确诊断，并且已经造成永久不可逆的神经系统功能损害。永久不可逆的神经系统损害指被保险人持续180天无法独立完成下列基本日常生活活动：（1）移动：自己从一个房间到另一个房间；或者（2）进食：自己从已准备好的碗或碟中取食物放入口中。
9.28严重冠心	指经根据冠状动脉造影检查结果明确诊断为三支主要血管严重狭窄性病变（至少一支血病管管腔直径减少75以上和其他两支血管管腔直径减少60以上）。冠状动脉的主要血管指左冠状动脉主干、前降支、左旋支及右冠状动脉。前降支、左旋支及右冠状动脉的分支血管的狭窄不作为本保障的衡量指标。
9.29严重心肌	指被保人因心肌病（包括扩张型心肌病、肥厚型心肌病及限制型心肌病）导致慢性心功病能损害造成永久不可逆性的心功能衰竭。心功能衰竭程度达到纽约心脏病学会的心功能分级标准之心功能IV级。被保险人永久不可逆性的体力活动能力受限，不能从事任何体力活动。继发于酒精滥用性的心肌病不在此保障范围之内。
9.30系统性红	指系统性红斑狼疮患者并发狼疮性肾炎而影响和损害肾脏功能，且肌酐清除率持续低于斑狼疮性30ml/分。系统性红斑狼疮性肾炎的诊断必须经专科医生确诊，并满足下列条件：肾炎（1）临床表现至少具备下列条件的四个：蝶形红斑或盘形红斑；光敏感；口鼻腔黏膜溃疡；非畸形性关节炎或多关节痛；胸膜炎或心包炎；癫痫或精神症状；血象异常(白细胞小于410/L或血小板小于10010/L或溶血性贫血)。（2）检测结果至少具备下列条件的两个：抗dsDNA抗体阳性；抗Sm抗体阳性；抗核抗体阳性；皮肤狼疮带试验(非病损部位)或肾活检阳性；C3降低。
9.31由输血或	被保险人感染上人类免疫缺陷病毒（HIV）并且满足下列全部条件：输液而感（1）在保障起始日或复效日之后，被保险人因治疗必须接受输血而感染HIV；染艾滋病（2）提供输血治疗的输血中心或医院出具该项输血感染属医疗责任事故的报告，或者法病毒院终审裁定为医疗责任并且不准上诉；（3）受感染的被保险人不是血友病患者；（4）提供输血治疗的输血中心或医院必须拥有合法经营执照。在任何治愈艾滋病（AIDS）或阻止HIV病毒作用的疗法被发现以后，或能防止AIDS发生的医疗方法被研究出来以后，本保障将不再予以赔付。任何因其他传播方式（包括：性传播或静脉注射毒品）导致的HIV感染不在本保单保障范围内。保险公司必须拥有获得使用被保险人的所有血液样本的权利和能够对这些样本进行独立检验的权利。
9.32因职业关	被保险人在其常规职业工作过程中遭遇外伤，或者职业需要处理血液或者其他体液时感系导致的染上人类免疫缺陷病毒（HIV）。人类免疫必须满足下列全部条件：缺陷病毒（1）感染必须是在被保险人正在从事其职业工作中发生，该职业必须属于以下列表内的职业；（HIV）感染（2）血清转化必须出现在事故发生后的6个月以内；（3）必须提供被保险人在所报事故发生后的5天以内进行的检查报告，该报告必须显示被保险人血液HIV病毒阴性和/或HIV抗体阴性；（4）必须在事故发生后的12个月内证实被保险人体内存在HIV病毒或者HIV抗体。职业限制如下所示:
9.33特发性慢	指自身免疫性肾上腺炎（既往称：特发性肾上腺皮质萎缩）导致肾上腺萎缩和慢性肾上性肾上腺腺皮质功能减退。必须满足所有以下条件：皮质功能（1）明确诊断，符合所有以下诊断标准：血浆促肾上腺皮质激素(ACTH)水平测定，衰竭100pg/ml；血浆肾素活性、血管紧张素II和醛固酮测定，显示为原发性肾上腺皮质功能减退症；促肾上腺皮质激素(ACTH)刺激试验显示为原发性肾上腺皮质功能减退症。（2）已经采用皮质类固醇替代治疗180天以上。本保障仅包括由自身免疫功能紊乱所导致的慢性肾上腺功能减退，其他成因（包括但不限于：肾上腺结核、HIV感染或艾滋病、感染、肿瘤）所致的原发性肾上腺皮质功能减退和继发性肾上腺皮质功能减退均不在保障范围内。
9.34植物人状	植物人状态系指由于严重颅脑外伤造成大脑和/或脑干严重损害导致完全永久性的对自态身和环境的意识丧失和中枢神经系统功能丧失，仅残存植物神经功能的疾病状态。诊断必须明确并且具有严重颅脑外伤和脑损害的证据。植物人状态必须持续30天以上方可申请理赔。
9.35额颞叶痴	指一组以额颞叶萎缩为特征的痴呆综合征，临床以明显的人格、行为改变和认知障碍为呆特征。被保险人自主生活能力完全丧失，无法独立完成六项基本日常生活活动中的三项或三项以上，日常生活必须持续受到他人监护。导致痴呆的疾病必须明确诊断，并且有完整的临床、实验室和影像学检查结果证实。神经官能症，精神疾病及酒精中毒所致脑损害不在保障范围内。
9.36重症急性	是一种由细菌侵入皮下组织和筋膜引起的急性坏死性软组织感染，可伴有毒血症、败血坏死性筋症、中毒性休克、弥漫性血管内凝血及多器官衰竭。必须满足以下所有条件：膜炎（1）细菌培养和临床表现符合坏死性筋膜炎诊断标准；（2）病情迅速恶化，有脓毒血症表现；（3）受感染肢体被截肢（自腕关节或踝关节近端）。
9.37严重类风	类风湿性关节炎为广泛分布的慢性进行性多关节病变，表现为关节严重变形，侵犯至少三个主要关节或关节组(如：双手（多手指）关节、双足（多足趾）关节、双腕关节、双湿性关节炎膝关节和双髋关节)。类风湿性关节炎必须明确诊断并且已经达到类风湿性关节炎功能分类IV级的永久不可逆性关节功能障碍（生活不能自理，且丧失工作能力）并且满足下列全部条件：（1）晨僵；（2）对称性关节炎；（3）类风湿性皮下结节；（4）类风湿因子滴度升高；（5）X线显示严重的关节（软骨和骨）破坏和关节畸形。
9.38严重克隆	克隆病是一种慢性肉芽肿性肠炎，具有特征性的克隆病病理组织学变化。诊断必须由病病理检查结果证实。被保险人所患的克隆病必须已经造成瘘管形成并伴有肠梗阻或肠穿孔。
9.39严重溃疡	本保单所保障的溃疡性结肠炎是指伴有致命性电解质紊乱的急性暴发性溃疡性结肠炎，性结肠炎病变累及全结肠，表现为严重的血便和系统性症状体征，治疗通常采取全结肠切除和回肠造瘘术。溃疡性结肠炎必须根据组织病理学特点诊断，并且被保险人已经接受了结肠切除和回肠造瘘术。
9.40原发性硬	指一种胆汁淤积综合征，其特征是肝内、肝外胆道因纤维化性炎症逐渐狭窄，并最终导致完全阻塞而发展为肝硬化。本病须经内镜逆行胰胆管造影等影像学检查证实，并须满化性胆管炎足下列全部条件：（1）总胆红素和直接胆红素同时升高，血清ALP200U/L；（2）持续性黄疸病史；（3）出现胆汁性肝硬化或门脉高压。因肿瘤或胆管损伤等继发性的硬化性胆管炎不在保障范围内。
9.41级重症	级重症急性胰腺炎是指急性胰腺炎伴有脏器功能障碍。被保险人所患的级重症急性胰腺炎必须明确诊断，按APACHE评分达到8分或8分以上和Balthazar分级系统达到急性胰腺炎级或级以上，并且接受了外科剖腹手术治疗，以进行坏死组织清除、坏死病灶切除或胰腺切除。因酗酒或饮酒过量所致的急性坏死性胰腺炎以及腹腔镜手术不在保障范围内。
9.42非阿尔茨	指因阿尔茨海默病以外的脑的器质性疾病造成脑功能衰竭导致永久不可逆性的严重痴海默病所呆，临床表现为明显的认知能力障碍、行为异常和社交能力减退。被保险人自主生活能力完全丧失，无法独立完成六项基本日常生活活动中的三项或三项以上，日常生活必须致严重痴呆持续受到他人监护。导致痴呆的疾病必须明确诊断，并且由完整的临床、实验室和影像学检查结果证实。神经官能症，精神疾病及酒精中毒所致脑损害不在保障范围内。
9.43脑动脉瘤	指脑动脉瘤破裂引起蛛网膜下腔出血，导致突发神经系统功能损害。被保险人在蛛网膜破裂开颅下腔出血后实际实施了在全麻下经骨瓣开颅进行的脑动脉瘤的外科手术治疗。脑动脉瘤手术诊断必须由脑动脉造影或其他影像学检查证据支持。未破裂之脑动脉瘤的手术、钻孔或小骨窗开颅或其他颅内或脑内出血清除或吸除手术、非开颅的脑立体定向手术或伽玛刀手术、血管内介入治疗、脑囊肿切除、垂体瘤切除及颅内血管畸形手术不在保障范围内。
9.44主动脉夹	指主动脉壁在受到某些病理因素的破坏后，高速、高压的主动脉血流将其内膜撕裂，以层瘤致主动脉腔内的血流通过主动脉内膜的破裂口进入主动脉内壁而形成血肿。被保险人需通过电脑断层扫描（CT）、磁共振扫描（MRI）、磁共振血管检验法（MRA）或血管扫描等检查,并须经专科医生确诊。
9.45系统性硬	系统性硬皮病（须累及内脏器官），指一种以局限性或弥漫性皮肤增厚和皮肤、血管、内皮病脏器官异常纤维化为特征的结缔组织病。本病须经专科医师明确诊断，并须满足下列至少一项条件：（1）肺脏：肺部病变进而发展为肺间质纤维化和肺动脉高压；（2）心脏：心功能受损达到美国纽约心脏病学会心功能状态分级IV级；（3）肾脏：肾脏受损导致双肾功能慢性不可逆衰竭，达到尿毒症期。下列疾病不在本险种保障范围内：局部性硬皮病（如：带状硬皮病、硬斑病）；嗜酸性粒细胞性筋膜炎；CREST综合征。
9.46严重慢性	指慢性反复发作的胰腺炎症导致胰腺的广泛纤维化、坏死、弥漫性钙化及假性囊肿形成，复发性胰造成胰腺功能障碍出现严重糖尿病和营养不良。必须满足以下所有条件：腺炎（1）CT显示胰腺广泛钙化或逆行胰胆管造影（ERCP）显示胰管扭曲、扩张和狭窄；（2）接受胰岛素替代治疗和酶替代治疗180天以上。因酒精所致的慢性复发性胰腺炎除外。
9.47胰腺移植	指因胰腺功能衰竭，已经实施了在全身麻醉下进行的胰腺的异体器官移植手术。单纯胰岛移植、部分胰腺组织或细胞的移植不在本保障范围内。
9.48严重心肌	指被保人因严重心肌炎性病变导致心功能损害造成持续的永久不可逆性的心功能衰竭。炎必须满足所有以下条件：（1）心功能衰竭程度达到纽约心脏病学会的心功能分级标准之心功能IV级，或左室射血数低于30；（2）持续不间断180天以上；（3）被保险人永久不可逆性的体力活动能力受限，不能从事任何体力活动。
9.49肺源性心	指被保人因慢性肺部疾病导致慢性心功能损害造成永久不可逆性的心功能衰竭。心功能脏病衰竭程度达到纽约心脏病学会的心功能分级标准之心功能IV级。被保险人永久不可逆性的体力活动能力受限，不能从事任何体力活动。
9.50嗜铬细胞	指发生在肾上腺或肾上腺外嗜铬组织的以分泌过多的儿茶酚胺为表现的神经内分泌肿瘤瘤。嗜铬细胞瘤必须由内分泌专科医生诊断，并且满足以下所有条件：（1）临床有高血压症候群表现；（2）已经实施了嗜铬细胞瘤切除手术。
9.51范可尼综	也称Fanconi综合征，指近端肾小管的功能异常引起的一组症候群。须经专科医生诊合征断，且须满足下列至少三项条件：(1)尿液检查出现肾性糖尿、全氨基酸糖尿或磷酸盐尿；(2)血液检查出现低磷血症、低尿酸血症或近端肾小管酸中毒；(3)出现骨质疏松、骨骼畸形或尿路结石。(4)通过骨髓片、白细胞、直肠黏膜中的结晶分析或裂隙灯检查角膜有胱氨酸结晶。被保险人在三周岁之前患该疾病，本公司不承担保险责任。
9.52疾病或外	因严重头部创伤或疾病造成被保险人智力低常（智力低于常态）或智力残疾。根据智商伤所致智（IQ）智力低常分为轻度（IQ5070）；中度（IQ3550）；重度（IQ2035）和极重度（IQ20）。力障碍（残智商7085为智力临界低常，不在本保障范围内。智商的检测必须由我们认可的疾）专职心理测验工作者进行，心理测验工作者必须持有由心理测量专业委员会资格认定书。根据被保险人年龄采用对应的智力量表如韦克斯勒智力量表（儿童智力量表或成人智力量表）。理赔时必须满足下列全部条件：（1）被保险人大于或等于六周岁；（2）专科医生确诊被保险人由于严重头部创伤或疾病造成智力低下；（3）专职合格心理检测工作者适时做的心理检测证实被保险人智力低常（轻度、中度、重度或极重度）；（4）被保险人的智力低常自确认日起持续180天以上。
9.53亚急性硬	是麻疹或麻疹样病毒所致的一种中枢神经系统慢感染。中枢神经系统呈现灰质和白质破坏为特征的慢性和急性混合存在的炎症。必须符合所有以下条件：化性全脑炎（1）必须由三甲医院诊断，临床检查证实脑电图存在周期性复合波、脑脊液球蛋白升高、脑脊液和血清中麻疹抗体滴定度升高；（2）被保险人出现运动障碍，自主生活能力完全丧失，无法独立完成六项基本日常生活活动中的三项或三项以上。
9.54克雅氏病	克雅氏病是一种传染性海绵状脑病，临床表现为快速进行性痴呆、肌阵挛和特征性脑电（CJD、人图变化。本病须经三级医院的专科医师根据WHO诊断标准明确诊断，并且被保险人自类疯牛病）主生活能力完全丧失，无法独立完成六项基本日常生活活动中的三项或三项以上。克雅氏病疑似病例除外。
9.55丝虫病所	指因丝虫感染导致淋巴阻塞性出现严重淋巴水肿，达到国际淋巴学会淋巴肿分期第III期，致象皮病临床表现为肢体象皮肿，患肢较健肢增粗30以上，无法独立完成六项基本日常生活活动中的三项或三项以上。
9.56埃博拉病	指埃博拉病毒感染导致的急性出血性传染病。埃博拉病毒病必须经国家认可的有合法资毒感染（伊质的传染病专家确诊并且上报国家疾病控制中心接受了隔离和治疗，必须满足以下所有波拉病毒条件：感染）（1）实验室检查证据证实存在埃博拉病毒感染；（2）存在广泛出血的临床表现；（3）病程持续30天以上。单纯实验室诊断但没有临床出血表现的或者在确诊之前已经死亡的不在本保障范围内。
9.57严重自身	自身免疫性肝炎是一种原因不明的慢性肝脏的坏死性炎性疾病，机体免疫机制被破坏，产生针对肝脏自身抗原的抗体导致自身免疫反应，从而破坏肝细胞造成肝脏炎症坏死，免疫性肝炎进而发展为肝硬化。必须满足所有以下条件：（1）高球蛋白血症；（2）血液中存在高水平的自身免疫抗体，如ANA（抗核抗体）、SMA（抗平滑肌抗体）、抗LKM1抗体或抗SLA/LP抗体；（3）肝脏活检证实免疫性肝炎；（4）临床已经出现腹水、食道静脉曲张和脾肿大等肝硬化表现。
9.58严重组织	是指一组单核巨噬细胞（组织细胞）异常增生的疾病。理赔时须满足下列所有条件：（1）支气管镜活检或开胸肺活检病理检查证实；细胞增生症（2）已导致呼吸衰竭和右心衰竭；（3）影像学检查显示蜂窝肺。
9.59席汉氏综	指因产后大出血并发休克、全身循环衰竭、弥漫性血管内凝血导致脑垂体缺血坏死和垂合征体分泌激素不足，造成性腺、甲状腺、肾上腺皮质功能减退。必须满足下列所有条件：（1）产后大出血休克病史；（2）严重腺垂体功能破坏，破坏程度95；（3）影像学检查显示脑垂体严重萎缩或消失；（4）实验室检查显示：垂体前叶激素全面低下（包括生长激素、促甲状腺素、促肾上腺皮质激素、卵泡刺激素和黄体生成素）；和性激素、甲状腺素、肾上腺皮质激素全面低下；（5）需要终身激素替代治疗以维持身体功能，持续服用各种替代激素超过一年。
