question	answer
2.保险单周年日	保险单周年日指在本合同有效期内的每一个保险单年度内本合同生效日的对应日。第一个保单周年日是指保险单生效一年后的本合同生效日期的对应日。
3.保险单年度	保险单年度从本合同生效日或保单周年日零时起至下一年度的保单周年日零时止为一个保单年度。
4.保险费到期日	保险费到期日指本合同生效日在每月、每季、每半年或每年（根据交费方式确定）的对应日。若当月没有对应的同一日，则以该月最后一日为对应日。
5.意外伤害	意外伤害指因遭受意外事故并以此为直接且单独原因导致的身体伤害。意外事故指外来的、非本意的、突然的、剧烈的、非疾病的意外事件。猝死不属于意外伤害。猝死是指貌似健康的人因潜在疾病、机能障碍或其他原因在出现症状后24小时内发生的非暴力性突然死亡，属于疾病身故。猝死的认定，如有公安机关、检察院、法院等司法机关的法律文件、医疗机构的诊断书等，则以上述法律文件、诊断书等为准。
6.首次患有	首次患有指被保险人自出生后第一次患有本合同所定义的轻症疾病、中症疾病、重大疾病或达到疾病终末期阶段。
7.轻症疾病	轻症疾病指被保险人发生符合以下疾病定义所述条件的疾病（共35种），应当由专科医生（见释义24）明确诊断。
7.1极早期的	指经组织病理学检查被明确诊断为下列恶性病变，并且接受了相应的治疗。恶性肿瘤或（1）原位癌；恶性病变（2）相当于Binet分期方案A期程度的慢性淋巴细胞白血病；（3）相当于AnnArbor分期方案I期程度的何杰金氏病；（4）皮肤癌（不包括恶性黑色素瘤及已发生转移的皮肤癌）；（5）TNM分期为T1N0M0期或更轻分期的前列腺癌。原位癌指恶性细胞局限于上皮内尚未穿破基底膜浸润周围正常组织的癌细胞新生物。原位癌必须经对固定活组织的组织病理学检查明确诊断。被保险人必须己经接受了针对原位癌病灶的积极治疗。
7.2不典型的急	指被临床诊断为急性心肌梗塞并接受了急性心肌梗塞治疗，虽然未达到重大疾病急性性心肌梗塞心肌梗塞（见释义9.2）的给付标准，但满足下列至少两项条件：（1）典型临床表现，例如急性胸痛等；（2）新近的心电图改变提示急性心肌梗塞；（3）心肌酶或肌钙蛋白有诊断意义的升高，或呈符合急性心肌梗塞的动态性变化；（4）发病90日后，经检查证实左心室功能降低，如左心室射血分数低于50。如被保险人同时或先后达到不典型的急性心肌梗塞（见释义7.2）、微创冠状动脉搭桥手术（见释义7.3）和微创冠状动脉介入手术(非开胸手术)（见释义7.4）的赔付标准，我们仅赔付其中一项轻症疾病保险金；赔付后另外两个病种轻症责任终止。
7.3微创冠状动	指为纠正冠状动脉的狭窄或堵塞，而实际实施的微创冠状动脉旁路移植手术。手术通过脉搭桥手术微创开胸术（肋骨间小切口）进行，且诊断须由冠状动脉血管造影检查确诊狭窄或堵塞。微创冠状动脉绕道也包括锁孔冠脉搭桥手术。必须满足下列全部条件：(1)血管造影显示至少两支冠状动脉狭窄超过50或一支冠状动脉狭窄超过70；(2)手术须由心脏专科医师进行，并确认该手术的必要性。如被保险人同时或先后达到不典型的急性心肌梗塞（见释义7.2）、微创冠状动脉搭桥手术（见释义7.3）和微创冠状动脉介入手术(非开胸手术)（见释义7.4）的赔付标准，我们仅赔付其中一项轻症疾病保险金；赔付后另外两个病种轻症责任终止。
7.4微创冠状动	为了治疗明显的冠状动脉狭窄性疾病，首次实际实施了冠状动脉球囊扩张成形术、冠状脉介入手术动脉支架植入术、冠状动脉粥样斑块切除术或激光冠状动脉成形术。（非开胸手如被保险人同时或先后达到不典型的急性心肌梗塞（见释义7.2）、微创术）冠状动脉搭桥手术（见释义7.3）和微创冠状动脉介入手术(非开胸手术)（见释义7.4）的赔付标准，我们仅赔付其中一项轻症疾病保险金，赔付后另外两个病种轻症责任终止。
7.5心脏瓣膜介	为了治疗心脏瓣膜疾病，实际实施了非开胸的经胸壁打孔内镜手术或经皮经导管介入手入手术术进行的心脏瓣膜置换或修复手术。
7.6主动脉内手	为了治疗主动脉疾病实际实施了经皮经导管进行的动脉内手术。主动脉指胸主动脉和腹术主动脉，不包括胸主动脉和腹主动脉的分支血管。
7.7脑垂体瘤、	指经头颅断层扫描（CT）、核磁共振（MRI）或其他影像学检查被确诊为下列病变，并实脑囊肿、脑际接受了手术或放射治疗。动脉瘤及脑（1）脑垂体瘤；血管瘤（2）脑囊肿；（3）脑动脉瘤、脑血管瘤。如被保险人同时或先后达到脑垂体瘤、脑囊肿、脑动脉瘤及脑血管瘤（见释义7.7）和微创颅脑手术（见释义7.8）的赔付标准，我们仅赔付其中一项轻症疾病保险金，赔付后另外一个病种轻症责任终止。
7.8微创颅脑手	因疾病被保险人确已实施全麻下的颅骨钻孔手术或者经鼻蝶窦入颅手术。术因外伤而实施的脑外科手术不在保障范围内。如被保险人同时或先后达到脑垂体瘤、脑囊肿、脑动脉瘤及脑血管瘤（见释义7.7）和微创颅脑手术（见释义7.8）的赔付标准，我们仅给付其中一项轻症疾病保险金，赔付后另外一个病种轻症责任终止。
7.9慢性肝功能	指因慢性肝脏疾病导致持续180天肝功能衰竭，须满足下列全部条件：衰竭失代偿（1）持续性黄疸，胆红素2mg；早期（2）白蛋白3g；（3）凝血酶原时间延长4秒；因酗酒或药物滥用导致的肝功能衰竭不在保障范围内。
7.10急性坏死	指被保险人被确诊为急性坏死性胰腺炎，并实际接受了腹腔镜手术治疗，以进行坏死组性胰腺炎腹织清除、坏死病灶切除或胰腺切除。腔镜手术因酗酒或饮酒过量所致的急性坏死性胰腺炎不在保障范围内。
7.11慢性肾功	指被保险人因双肾功能慢性不可逆性损害，持续180天达到肾功能衰竭期，诊断必须满能损害肾功足所有以下标准：能衰竭期（1）肾小球滤过率（GFR）25ml/min或肌酐清除率（Ccr）25ml/min；（2）血肌酐（Scr）5mg/dl或442umol/L。
7.12严重的骨	严重的骨质疏松，并因此而直接导致脊椎、骨盆、桡骨、尺骨、肱骨、胫骨、股骨骨折。质疏松骨质疏松的诊断必须由本公司认可医院合格的专科医生做出，并符合世界卫生组织关于骨质疏松的诊断标准。世界卫生组织关于骨质疏松的定义：骨密度检测，T值小于2.5
7.13轻度原发	指由于原发性肺动脉高压进行性发展而导致右心室肥厚，已经造成永久不可逆（见释义25）性的体力活动能力受限，达到美国纽约心脏病学会心功能状态分级III级，且静息状性肺动脉高压态下肺动脉平均压超过25mmHg、不超过30mmHg。
7.14轻度视力	指因疾病或意外伤害导致双目视力永久不可逆性丧失，虽然未达到重大疾病双目失明受损（见释义9.14）的给付标准，但满足下列全部条件：（1）双眼中较好眼矫正视力低于0.1（采用国际标准视力表，如果使用其他视力表应进行换算）；（2）视野半径小于20度。在0周岁至3周岁保单周年日期间，被保险人首次患有轻度视力受损除外。如被保险人同时或先后达到轻度视力受损（见释义7.14）、单眼失明（见释义7.15）和角膜移植（见释义7.16）的赔付标准，我们仅赔付其中一项轻症疾病保险金，赔付后另外两个病种轻症责任终止。
7.15单眼失明	指因疾病或意外伤害导致单眼视力永久不可逆性丧失，须满足下列至少一项条件：（1）眼球缺失或摘除；（2）矫正视力低于0.02（采用国际标准视力表，如果使用其它视力表应进行换算）；（3）视野半径小于5度。在0周岁至3周岁保单周年日期间，被保险人首次患有单眼失明除外。如被保险人同时或先后达到轻度视力受损（见释义7.14）、单眼失明（见释义7.15）和角膜移植（见释义7.16）的赔付标准，我们仅赔付其中一项轻症疾病保险金，赔付后另外两个病种轻症责任终止。
7.16角膜移植	指为增进视力或治疗某些角膜疾患，已经实施了异体的角膜移植手术。此手术必须由专科医生认为是医学上必需的情况下进行。如被保险人同时或先后达到轻度视力受损（见释义7.14）、单眼失明（见释义7.15）和角膜移植（见释义7.16）的赔付标准，我们仅赔付其中一项轻症疾病保险金，赔付后另外两个病种轻症责任终止。
7.17轻度听力	指因疾病或者意外伤害导致双耳听力永久不可逆性丧失，在500赫兹、1000赫兹和2000受损赫兹语音频率下，平均听阈大于70分贝，且经纯音听力测试、声导抗检测或者听觉诱发电位检测等证实。在0周岁至3周岁保单周年日期间，被保险人首次患有轻度听力受损除外。如被保险人同时或先后达到轻度听力受损（见释义7.17）、单耳失聪（见释义7.18）和人工耳蜗植入术（见释义7.19）的赔付标准，我们仅赔付其中一项轻症疾病保险金，赔付后另外两个病种轻症责任终止。
7.18单耳失聪	指因疾病或者意外伤害导致单耳听力永久不可逆性丧失，在500赫兹、1000赫兹和2000赫兹语音频率下，平均听阈大于90分贝，且经纯音听力测试、声导抗检测或者听觉诱发电位检测等证实。在0周岁至3周岁保单周年日期间，被保险人首次患有单耳失聪除外。如被保险人同时或先后达到轻度听力受损（见释义7.17）、单耳失聪（见释义7.18）和人工耳蜗植入术（见释义7.19）的赔付标准，我们仅赔付其中一项轻症疾病保险金，赔付后另外两个病种轻症责任终止。
7.19人工耳蜗	指由于耳蜗的永久损害而实际实施了人工耳蜗植入手术。需经专科医师确认手术在医学植入术上是必要的，且在植入手术之前已经符合下列全部条件：（1）双耳持续12个月以上重度感音神经性耳聋；（2）使用相应的听力辅助设备效果不佳。如被保险人同时或先后达到轻度听力受损（见释义7.17）、单耳失聪（见释义7.18）和人工耳蜗植入术（见释义7.19）的赔付标准，我们仅赔付其中一项轻症疾病保险金，赔付后另外两个病种轻症责任终止。
7.20硬脑膜下	为清除或引流因意外伤害导致的血肿，需于头部进行开颅或钻孔手术。血肿手术开颅或钻孔手术必须在我们认可的医疗机构内由专科医生认为是医疗必须的情况下进行。
7.21植入大脑	为缓解已升高的脑脊液压力而确实已在脑室进行分流器植入手术。内分流器诊断及治疗均须在我们认可的医疗机构内由脑神经科专科医生认为是医疗必须的情况下进行。
7.22深度昏迷	指因疾病或意外伤害导致意识丧失，对外界刺激和体内需求均无反应，昏迷程度按照格48小时拉斯哥昏迷分级（Glasgowcomascale）结果为5分或5分以下，且已经持续使用呼吸机及其它生命维持系统达到48小时，且未达到重大疾病深度昏迷（见释义9.12）的赔付标准。因酗酒或药物滥用导致的深度昏迷不在保障范围内。
7.23因肾上腺	因肾上腺皮质腺瘤所导致的醛固酮分泌过多而产生的继发性恶性高血压而实际接受了肾皮质腺瘤切上腺切除术治疗。除肾上腺此诊断及治疗均须在我们认可的医疗机构内由专科医生认为是医疗必须的情况下进行。
7.24心包膜切	因心包膜疾病导致已接受心包膜切除术或已进行任何需要心脏小切口技术的手术。手术除术必须在心脏科医生认为是医学上必需的情况下进行。
7.25于颈动脉	指根据颈动脉造影检查结果，确诊一条或以上颈动脉存在严重狭窄性病变（至少一支血进行血管成管管腔直径减少50以上）。本病须经国家机关认可的有合法资质的专科医生明确诊断，形术或内膜同时必须已经采取以下手术以减轻症状：切除术（1）确实进行动脉内膜切除术；或（2）确实进行血管介入治疗，例如血管成形术及或进行植入支架或动脉粥样瘤清除手术。
7.26腔静脉过	指经本公司认可医院的专科医生证明有反复肺栓塞发作及抗凝治疗无效而必须接受手术滤器植入术植入腔静脉过滤器。理赔时需提供完整病历及手术记录以证明植入腔静脉过滤器有必要性及已确实施行了手术。
7.27早期象皮	指因丝虫感染导致淋巴管阻塞而造成身体组织出现严重淋巴水肿。此病症须经本公司认病可医院的专科医生根据临床表现和微丝蚴的化验结果确诊。急性淋巴管炎或其它原因引起的淋巴水肿并不在保障范围取
7.28心脏起搏	因严重心律失常而确实已行植入永久性心脏起搏器或除器的手术。理赔时须提供完整器或除颤器病历资料及手术记录以证实此严重心律失常并不能以其他方法治疗。植入诊断及治疗均须在我们认可的医疗机构内由专科医生认为是医疗必须的情况下进行。
7.29早期原发	被诊断为原发性心肌病，并符合下列所有条件：性心肌病（1）导致心室功能受损，其受损程度达到美国纽约心脏病学会心脏功能分级的第III级，或其同等级e，即：体力活动明显受限，休息时无症状，轻于日常的活动即可引起充血性心力衰竭的症状；（2）左室射血分数LVEF35；（3）原发性心肌病的诊断必须由本公司认可医院的心脏专科医生确认，并提供心脏超声检查结果报告。本保障范围内的心肌病包括扩张型心肌病、肥厚型心肌病及限制型心肌病，继发于酒精滥用性的心肌病不在此保障范围之内。
7.30较小面积	指烧伤程度为度，且度烧伤面积达到全身体表面积的10或10以上，体表面积根III度烧伤据中国新九分法计算，且未达到中症疾病中度面积III度烧伤（见释义8.4）和重大疾病严重III度烧伤（见释义9.20）的给付标准。
7.31肝脏切除	指因疾病或意外事故实际实施的肝脏部分切除术，手术须有至少一个完整的肝叶切除。因药物滥用、酗酒导致的肝脏损伤不在保障范围内。肝脏捐献引起的手术不在保障范围内。
7.32单侧肾脏	指因疾病或意外事故实际实施的一侧肾脏切除术。切除肾脏部分切除手术和肾脏捐献引起的手术不在保障范围内。
7.33双侧睾丸	指为治疗疾病实际接受了双侧睾丸完全切除手术。切除术部分睾丸切除不在保障范围。
7.34双侧卵巢	指为治疗疾病实际接受了经腹部切开或腹腔镜进行的双侧卵巢完全切除手术。切除术部分卵巢切除不在保障范围。
7.35可逆性再	指因急性可逆性的骨髓造血功能衰竭而导致贫血、中性粒细胞减少和血小板减少，必须由血液科医生的诊断，且病历资料显示接受了下列任一治疗：生障碍性贫血（1）骨髓刺激疗法至少1个月；（2）免疫抑制剂治疗至少1个月。
8.中症疾病	中症疾病指被保险人发生符合以下疾病定义所述条件的疾病（共20种），应当由专科医生明确诊断。
8.1中度类风湿	类风湿性关节炎为广泛分布的慢性进行性多关节病变，表现为关节严重变形，侵犯两个性关节炎主要关节或关节组(如：双手（多手指）关节、双足（多足趾）关节、双腕关节、双膝关节和双髋关节)。且被保险人满足至少180天无法独立完成六项基本日常生活活动（见释义26）中的两项。
8.2中度脑中风	指因脑血管的突发病变引起脑血管出血、栓塞或者梗塞，并导致神经系统出现功能障碍后遗症表现，在确诊180天后神经系统功能障碍程度虽未达到重大疾病脑中风后遗症（见释义9.3）的给付标准，但仍遗留下列一种或者一种以上障碍：（1）一肢或一肢以上肢体肌力III级或III级以下的运动功能障碍；（2）自主生活能力完全丧失，无法独立完成六项基本日常生活活动中的两项或者两项以上。短暂性脑缺血发作(TIA)和腔隙性脑梗塞不在保障范围内。8.3中度脑损伤指因头部遭受机械性外力，引起脑重要部位损伤，导致神经系统永久性的功能障碍。须由头颅断层扫描（CT）、核磁共振检查（MRI）或正电子发射断层扫描（PET）等影像学检查证实。神经系统永久性的功能障碍，指脑损伤180天后，仍部分丧失自主生活能力，无法独立完成六项基本日常生活活动中的二项或以上。
8.4中度面积III	指烧伤程度为度，即全层皮肤烧伤，包括表皮、真皮和皮下组织，且理赔时须达到下度烧伤列条件之一：（1）度烧伤的面积达到全身体表面积的15或15以上；（2）面部度烧伤的面积达到面部表面积的3/5或全身体表面积的1.8。
8.5单个肢体缺	指因疾病或意外伤害导致一个肢体自腕关节或踝关节近端（靠近躯干端）以上完全性断失离。
8.6中度系统性	本项保障所指的系统性红斑狼疮必须符合下列所有理赔条件且未达到重大疾病系统性红斑狼疮红斑狼疮性肾炎（见释义9.30）的给付标准：（1）在下列5项情况中出现最少3项：非畸形性关节炎或多关节痛；胸膜炎或心包炎；肾病：24小时尿蛋白定量达到0.5克；血象异常(白细胞小于4109/L或血小板小于100109/L或溶血性贫血)；抗dsDNA抗体阳性，或抗Sm抗体阳性，或抗核抗体阳性。（2）系统性红斑狼疮的诊断必须经专科医生确诊。
8.7中度脑炎或	指因患脑炎或者脑膜炎导致的神经系统的功能障碍。疾病确诊180天后，仍存在自主生活能力完全丧失，无法独立完成六项基本日常生活活动中的两项。脑膜炎后遗症
8.8中度运动神	是一组中枢神经系统运动神经元的进行性变性疾病，进行性脊肌萎缩症、进行性延髓麻经元病痹症、原发性侧索硬化症、肌萎缩性侧索硬化症。须满足自主生活能力部分丧失，无法独立完成六项基本日常生活活动中的两项。
8.9中度帕金森	是一种中枢神经系统的退行性疾病，临床表现为震颤麻痹、共济失调等。须满足下列全氏病部条件：（1）药物治疗无法控制病情；（2）自主生活能力完全丧失，无法独立完成六项基本日常生活活动中的两项。继发性帕金森综合征不在保障范围内。
8.10结核性脊	指因结核杆菌引起的脊髓炎，导致永久性神经系统功能中度障碍，即：疾病首次确诊180髓炎天后，仍遗留下列障碍：自主生活能力部分丧失，无法独立完成六项基本日常生活活动中的二项或二项以上。该诊断必须由我们认可的医疗机构内的神经专科医生证实，并必须由适当的检查证明为结核性脊髓炎。
8.11中度脊髓	脊髓灰质炎是由于脊髓灰质炎病毒感染所致的瘫痪性疾病，临床表现为运动功能损害或灰质炎呼吸无力。脊髓灰质炎必须明确诊断。本保险合同仅对脊髓灰质炎造成的神经系统功能损害导致被保险人一肢肢体机能永久完全丧失的情况予以理赔。肢体机能永久完全丧失，指疾病确诊180天后，该肢三大关节中的至少一个大关节仍然完全僵硬，或不能随意识活动。
8.12中度瘫痪	指因疾病或者意外伤害导致一肢肢体机能永久完全丧失。肢体机能永久完全丧失，指疾病确诊180天后或意外伤害发生180天后，该肢三大关节中的两大关节仍然完全僵硬，或不能随意识活动。肢体是指包括肩关节的整个上肢或包括髋关节的整个下肢。自我伤害，病毒感染后的临时瘫痪或由于心理疾病造成的机能丧失不在保障范围内。
8.13中度肠道	严重肠道疾病或外伤导致小肠损害并发症，本疾病须满足以下所有条件：疾病并发症（1）至少切除了二分之一小肠；（2）完全肠外营养支持二个月以上。
8.14单侧肺脏	指因疾病或意外事故实际实施的一侧肺脏切除术。切除因药物滥用、酗酒、肺脏部分切除手术、肺脏捐献引起的手术不在保障范围内。
8.15中度严重	溃疡性结肠炎是指伴有致命性电解质紊乱的大肠（结肠及直肠）粘膜炎症，病变累及全大肠。须满足下列所有条件：溃疡性结肠炎（1）须经由内窥镜检查证实该疾病侵犯全部结肠及直肠，并经病理学组织切片检查证实为溃疡性结肠炎；（2）经专科注册医生以类固醇或免疫抑制剂连续治疗6个月。诊断及治疗均须在我们认可的医疗机构内由专科医师认为是医疗必须的情况下进行。
8.16中度进行	指一种少见的神经系统变性疾病，以假球麻痹、垂直性核上性眼肌麻痹、锥体外系肌僵直、步态共济失调和轻度痴呆为主要临床特征。性核上性麻痹须由我们认可的医疗机构的专科医生确诊，且满足自主生活能力完全丧失，无法独立完成六项基本日常生活活动中的两项。
8.17中度克雅	是一种传染性海绵状脑病，临床表现为快速进行性痴呆、肌阵挛和特征性脑电图变化。氏症须由我们认可的医疗机构的专科医生根据WHO诊断标准明确诊断，并且自主生活能力完全丧失，无法独立完成六项基本日常生活活动中的两项。
8.18中度克隆	是一种慢性肉芽肿性肠炎，具有特征性的克隆病病理组织学变化。诊断必须由专科医生病经过病理检查结果证实，被保险人所患的克隆症须经肠胃科专科医生以类固醇或免疫抑制剂连续治疗180天以上，且未达到重大疾病严重克隆病（见释义9.38）的给付标准。
8.19糖尿病并	因糖尿病引起的神经及血管病变累及足部，为了维持生命已经实际进行由足踝或者以上发症引致的位置的单足截除手术。手术须在我们认可的医疗机构的专科医生认为是医疗必须的情况单足截除下进行。切除多只脚趾或者因其他原因引起的截除术不在保障范围内。
8.20中度强直	是一种慢性全身性炎性疾病，主要侵犯脊柱导致脊柱畸形。必须明确诊断并且满足下列性脊柱炎所有条件且未达到重大疾病严重强直性脊柱炎（见释义9.82）的给付标准：（1）严重脊柱畸形；（2）自主生活能力完全丧失，无法独立完成六项基本日常生活活动中的两项或两项以上。
9.重大疾病	指被保险人发生符合以下疾病定义所述条件的疾病（共100种），应当由专科医生明确诊断。第1至第25项为中国保险行业协会与中国医师协会共同制定的重大疾病保险的疾病定义，第26至第100项为我们增加的疾病种类并自行制定的疾病定义。
9.1恶性肿瘤	指恶性细胞不受控制的进行性增长和扩散，浸润和破坏周围正常组织，可以经血管淋巴管和体腔扩散转移到身体其它部位的疾病。经病理学检查结果明确诊断，临床诊断属于世界卫生组织疾病和有关健康问题的国际统计分类（ICD10）的恶性肿瘤范畴。下列疾病不在保障范围内：（1）原位癌；（2）相当于Binet分期方案A期程度的慢性淋巴细胞白血病；（3）相当于AnnArbor分期方案I期程度的何杰金氏病；（4）皮肤癌（不包括恶性黑色素瘤及已发生转移的皮肤癌）；（5）TNM分期为T1N0M0期或更轻分期的前列腺癌；（6）感染艾滋病病毒或患艾滋病期间所患恶性肿瘤。
9.2急性心肌梗	指因冠状动脉阻塞导致的相应区域供血不足造成部分心肌坏死。须满足下列至少三项条塞件：（1）典型临床表现，例如急性胸痛等；（2）新近的心电图改变提示急性心肌梗塞；（3）心肌酶或肌钙蛋白有诊断意义的升高，或呈符合急性心肌梗塞的动态性变化；（4）发病90日后，经检查证实左心室功能降低，如左心室射血分数低于50。
9.3脑中风后遗	指因脑血管的突发病变引起脑血管出血、栓塞或梗塞，并导致神经系统永久性功能障碍。症神经系统永久性的功能障碍，指疾病确诊180天后，仍遗留下列一种或一种以上障碍：（1）一肢或一肢以上肢体机能完全丧失（见释义27）；（2）语言能力或咀嚼吞咽能力完全丧失（见释义28）；（3）自主生活能力完全丧失，无法独立完成六项基本日常生活活动中的三项或三项以上。
