question	answer
第三十条联系方式的变更	为了保障您的权益，如果您的联系方式（如联系地址、联系电话、电子邮箱等）发生变化，请及时通知我们。否则，我们将按已知的最后联系方式与您联系。
第三十一条争议处理	在合同履行过程中，双方发生争议时，可以从下列两种方式中选择一种争议处理方式：一、因履行本合同发生的争议，由双方协商解决，协商不成的，由双方达成仲裁协议通过仲裁解决；二、因履行本合同发生的争议，由双方协商解决，协商不成的，依法向人民法院起诉。如果双方选择仲裁方式，应当达成仲裁协议并明确约定仲裁事项、仲裁机构。
第三十二条重大疾病的种类及定义	本合同所保障的重大疾病，是指被保险人经专科医生28明确诊断初次发生下列疾病或初次达到下列疾病状态或在医院初次接受下列手术。本合同所保障的重大疾病共100种，其中125种为2007年4月3日启用的重大疾病保险的疾病定义使用规范中列明的重大疾病，该规范由中国保险行业协会制定，其他为我们增加的重大疾病。
1.恶性肿瘤	指恶性细胞不受控制的进行性增长和扩散，浸润和破坏周围正常组织，可以经血管、淋巴管和体腔扩散转移到身体其他部位的疾病。经病理学检查结果明确诊断，临床诊断属于世界卫生组织疾病和有关健康问题的国际统计分类（ICD10）的恶性肿瘤范畴。下列疾病不在保障范围内：（1）原位癌；28专科医生：专科医生应当同时满足以下四项资格条件：（1）具有有效的中华人民共和国医师资格证书；（2）具有有效的中华人民共和国医师执业证书，并按期到相关部门登记注册；（3）具有有效的中华人民共和国主治医师或主治医师以上职称的医师职称证书；（4）在二级或二级以上医院的相应科室从事临床工作三年以上。太平乐享无忧终身重大疾病保险，第10页，共24页（2）相当于Binet分期方案A期程度的慢性淋巴细胞白血病；（3）相当于AnnArbor分期方案I期程度的何杰金氏病；（4）皮肤癌（不包括恶性黑色素瘤及已发生转移的皮肤癌）；（5）TNM分期为T1N0M0期或更轻分期的前列腺癌（注：如果为女性重大疾病保险，则不包括此项）；（6）感染艾滋病病毒或患艾滋病期间所患恶性肿瘤。
2.急性心肌梗塞	指因冠状动脉阻塞导致的相应区域供血不足造成部分心肌坏死。须满足下列至少三项条件：（1）典型临床表现，例如急性胸痛等；（2）新近的心电图改变提示急性心肌梗塞；（3）心肌酶或肌钙蛋白有诊断意义的升高，或呈符合急性心肌梗塞的动态性变化；（4）发病90天后，经检查证实左心室功能降低，如左心室射血分数低于50。
3.脑中风后遗症	指因脑血管的突发病变引起脑血管出血、栓塞或梗塞，并导致神经系统永久性的功能障碍。神经系统永久性的功能障碍，指疾病确诊180天后，仍遗留下列一种或一种以上障碍：（1）一肢或一肢以上肢体机能完全丧失29；（2）语言能力或咀嚼吞咽能力完全丧失30；（3）自主生活能力完全丧失，无法独立完成六项基本日常生活活动31中的三项或三项以上。
4.重大器官移植术或造血干细	重大器官移植术，指因相应器官功能衰竭，已经实施了肾脏、肝脏、心脏胞移植术或肺脏的异体移植手术。造血干细胞移植术，指因造血功能损害或造血系统恶性肿瘤，已经实施了造血干细胞（包括骨髓造血干细胞、外周血造血干细胞和脐血造血干细胞）的异体移植手术。
5.冠状动脉搭桥术（或称冠状	指为治疗严重的冠心病，实际实施了开胸进行的冠状动脉血管旁路移植的动脉旁路移植术）手术。冠状动脉支架植入术、心导管球囊扩张术、激光射频技术及其他非开胸的介入手术、腔镜手术不在保障范围内。
6.终末期肾病（或称慢性肾功	指双肾功能慢性不可逆性衰竭，达到尿毒症期，经诊断后已经进行了至少能衰竭尿毒症期）90天的规律性透析治疗或实施了肾脏移植手术。
7.多个肢体缺失	指因疾病或意外伤害导致两个或两个以上肢体自腕关节或踝关节近端（靠近躯干端）以上完全性断离。
8.急性或亚急性重症肝炎	指因肝炎病毒感染引起肝脏组织弥漫性坏死，导致急性肝功能衰竭，且经血清学或病毒学检查证实，并须满足下列全部条件：（1）重度黄疸或黄疸迅速加重；29肢体机能完全丧失：指肢体的三大关节中的两大关节僵硬，或不能随意识活动。肢体是指包括肩关节的整个上肢或包括髋关节的整个下肢。30语言能力或咀嚼吞咽能力完全丧失：语言能力完全丧失，指无法发出四种语音（包括口唇音、齿舌音、口盖音和喉头音）中的任何三种、或声带全部切除，或因大脑语言中枢受伤害而患失语症。咀嚼吞咽能力完全丧失，指因牙齿以外的原因导致器质障碍或机能障碍，以致不能作咀嚼吞咽运动，除流质食物外不能摄取或吞咽的状态。31六项基本日常生活活动：指食物摄取、大小便始末、穿脱衣服、起居、步行、入浴。太平乐享无忧终身重大疾病保险，第11页，共24页（2）肝性脑病；（3）B超或其他影像学检查显示肝脏体积急速萎缩；（4）肝功能指标进行性恶化。
9.良性脑肿瘤	指脑的良性肿瘤，已经引起颅内压增高，临床表现为视神经乳头水肿、精神症状、癫痫及运动感觉障碍等，并危及生命。须由头颅X线断层扫描（CT）、核磁共振检查（MRI）或正电子发射断层扫描（PET）等影像学检查证实，并须满足下列至少一项条件：（1）实际实施了开颅进行的脑肿瘤完全切除或部分切除的手术；（2）实际实施了对脑肿瘤进行的放射治疗。脑垂体瘤、脑囊肿、脑血管性疾病不在保障范围内。
10.慢性肝功能衰竭失代偿期	指因慢性肝脏疾病导致肝功能衰竭。须满足下列全部条件：（1）持续性黄疸；（2）腹水；（3）肝性脑病；（4）充血性脾肿大伴脾功能亢进或食管胃底静脉曲张。因酗酒或药物滥用导致的肝功能衰竭不在保障范围内。
11.脑炎后遗症或脑膜炎后遗症	指因患脑炎或脑膜炎导致的神经系统永久性的功能障碍。神经系统永久性的功能障碍，指疾病确诊180天后，仍遗留下列一种或一种以上障碍：（1）一肢或一肢以上肢体机能完全丧失；（2）语言能力或咀嚼吞咽能力完全丧失；（3）自主生活能力完全丧失，无法独立完成六项基本日常生活活动中的三项或三项以上。
12.深度昏迷	指因疾病或意外伤害导致意识丧失，对外界刺激和体内需求均无反应，昏迷程度按照格拉斯哥昏迷分级（Glasgowcomascale）结果为5分或5分以下，且已经持续使用呼吸机及其他生命维持系统96小时以上。因酗酒或药物滥用导致的深度昏迷不在保障范围内。
13.双耳失聪三周岁始理赔	指因疾病或意外伤害导致双耳听力永久不可逆32性丧失，在500赫兹、1000赫兹和2000赫兹语音频率下，平均听阈大于90分贝，且经纯音听力测试、声导抗检测或听觉诱发电位检测等证实。被保险人申请理赔时年龄必须在三周岁以上，并且提供理赔当时的听力丧失诊断及检查证据。
14.双目失明三周岁始理赔	指因疾病或意外伤害导致双眼视力永久不可逆性丧失，双眼中较好眼须满足下列至少一项条件：（1）眼球缺失或摘除；（2）矫正视力低于0.02（采用国际标准视力表，如果使用其他视力表应进行换算）；（3）视野半径小于5度。被保险人申请理赔时年龄必须在三周岁以上，并且提供理赔当时的视力丧失诊断及检查证据。
15.瘫痪	指因疾病或意外伤害导致两肢或两肢以上肢体机能永久完全丧失。肢体机能永久完全丧失，指疾病确诊180天后或意外伤害发生180天后，每肢三32永久不可逆：指自疾病确诊或意外伤害发生之日起，经过积极治疗180天后，仍无法通过现有医疗手段恢复。太平乐享无忧终身重大疾病保险，第12页，共24页大关节中的两大关节仍然完全僵硬，或不能随意识活动。
16.心脏瓣膜手术	指为治疗心脏瓣膜疾病，实际实施了开胸进行的心脏瓣膜置换或修复的手术。
17.严重阿尔茨海默病	指因大脑进行性、不可逆性改变导致智能严重衰退或丧失，临床表现为明显的认知能力障碍、行为异常和社交能力减退，其日常生活必须持续受到他人监护。须由头颅X线断层扫描（CT）、核磁共振检查（MRI）或正电子发射断层扫描（PET）等影像学检查证实，且自主生活能力完全丧失，无法独立完成六项基本日常生活活动中的三项或三项以上。神经官能症和精神疾病不在保障范围内。
18.严重脑损伤	指因头部遭受机械性外力，引起脑重要部位损伤，导致神经系统永久性的功能障碍。须由头颅X线断层扫描（CT）、核磁共振检查（MRI）或正电子发射断层扫描（PET）等影像学检查证实。神经系统永久性的功能障碍，指脑损伤180天后，仍遗留下列一种或一种以上障碍：（1）一肢或一肢以上肢体机能完全丧失；（2）语言能力或咀嚼吞咽能力完全丧失；（3）自主生活能力完全丧失，无法独立完成六项基本日常生活活动中的三项或三项以上。
19.严重帕金森病	是一种中枢神经系统的退行性疾病，临床表现为震颤麻痹、共济失调等。须满足下列全部条件：（1）药物治疗无法控制病情；（2）自主生活能力完全丧失，无法独立完成六项基本日常生活活动中的三项或三项以上。继发性帕金森综合征不在保障范围内。
20.严重度烧伤	指烧伤程度为度，且度烧伤的面积达到全身体表面积的20或20以上。体表面积根据中国新九分法计算。
21.严重原发性肺动脉高压	指不明原因的肺动脉压力持续性增高，进行性发展而导致的慢性疾病，已经造成永久不可逆性的体力活动能力受限，达到美国纽约心脏病学会心功能状态分级IV级，且静息状态下肺动脉平均压超过30mmHg。
22.严重运动神经元病	是一组中枢神经系统运动神经元的进行性变性疾病，包括进行性脊肌萎缩症、进行性延髓麻痹症、原发性侧索硬化症、肌萎缩性侧索硬化症。须满足自主生活能力完全丧失，无法独立完成六项基本日常生活活动中的三项或三项以上的条件。
23.语言能力丧失三周岁始理	指因疾病或意外伤害导致完全丧失语言能力，经过积极治疗至少12个月赔（声带完全切除不受此时间限制），仍无法通过现有医疗手段恢复。精神心理因素所致的语言能力丧失不在保障范围内。被保险人申请理赔时年龄必须在三周岁以上，并且提供理赔当时的语言能力丧失诊断及检查证据。
24.重型再生障碍性贫血	指因骨髓造血功能慢性持续性衰竭导致的贫血、中性粒细胞减少及血小板减少。须满足下列全部条件：（1）骨髓穿刺检查或骨髓活检结果支持诊断；（2）外周血象须具备以下三项条件：中性粒细胞绝对值0.5109/L；网织红细胞1；血小板绝对值20109/L。太平乐享无忧终身重大疾病保险，第13页，共24页
25.主动脉手术	指为治疗主动脉疾病，实际实施了开胸或开腹进行的切除、置换、修补病损主动脉血管的手术。主动脉指胸主动脉和腹主动脉，不包括胸主动脉和腹主动脉的分支血管。动脉内血管成形术不在保障范围内。
26.严重多发性硬化	多发性硬化为中枢神经系统白质多灶性脱髓鞘病变，病变有时累及灰质。多发性硬化须由核磁共振检查（MRI）等影像学检查证实，经三级医院神经科专科医生明确诊断，并且已经造成永久不可逆的神经系统功能损害。永久不可逆神经系统功能损害指被保险人持续180天无法独立完成下列基本日常生活活动：（1）移动：自己从一个房间移动到另一个房间；或者（2）进食：自己从已准备好的碗或碟中取食物放入口中。
27.因职业关系导致的HIV感染	被保险人在其常规职业工作过程中遭遇外伤，或者职业需要处理血液或者其他体液时感染上人类免疫缺陷病毒（HIV）。理赔必须符合下列所有条件：（1）感染必须是在被保险人正在从事其职业工作中发生，该职业必须属于以下列表内的职业：（2）必须提供被保险人在所报事故发生后的5天以内进行的检查报告，该报告必须显示被保险人血液HIV病毒阴性和/或HIV抗体阴性；（3）必须在事故发生后的6个月内证实被保险人体内存在HIV病毒或者HIV抗体，即血液HIV病毒阳性和/或HIV抗体阳性。我们承担本项疾病责任不受本合同责任免除中被保险人感染艾滋病病毒或患艾滋病的限制。
28.特发性慢性肾上腺皮质功能	指自身免疫性肾上腺炎（既往称：特发性肾上腺皮质萎缩）导致肾上腺萎减退缩和慢性肾上腺皮质功能减退。必须满足所有以下条件：（1）明确诊断，符合所有以下诊断标准；血浆促肾上腺皮质激素(ACTH)水平测定大于100pg/ml；血浆和尿游离皮质醇及尿17羟皮质类固醇、17酮皮质类固醇测定、血浆肾素活性、血管紧张素II和醛固酮测定，显示为原发性肾上腺皮质功能减退症；血浆促肾上腺皮质激素(ACTH)刺激试验显示为原发性肾上腺皮质功能减退症。（2）已经采用皮质类固醇替代治疗180天以上。肾上腺结核、HIV感染或艾滋病感染、肿瘤所致的原发性肾上腺皮质功能减退和继发性肾上腺皮质功能减退不在保障范围内。
29.严重冠状动脉粥样硬化性心	指经心脏科专科医生根据冠状动脉造影检查结果确诊为主要血管严重狭脏病窄性病变，须满足下列至少一项条件：（1）左冠状动脉主干和右冠状动脉中，一支血管管腔堵塞75以上，另一支血管管腔堵塞60以上；（2）前降支、回旋支和右冠状动脉中，至少一支血管管腔堵塞75以上，太平乐享无忧终身重大疾病保险，第14页，共24页其他两支血管管腔堵塞60以上。前降支的分支血管、左旋支的分支血管及右冠状动脉的分支血管的狭窄不作为本保障的衡量指标。
30.脊髓灰质炎	指由于脊髓灰质炎病毒感染所致的瘫痪性疾病，临床表现为运动功能损害或呼吸无力。脊髓灰质炎必须明确诊断。本合同仅对脊髓灰质炎造成的神经系统功能损害导致被保险人一肢或一肢以上肢体机能永久完全丧失的情况予以理赔。肢体机能永久完全丧失，指疾病确诊180天后，每肢三大关节中的两大关节仍然完全僵硬，或不能随意识活动。
31.全身性（型）重症肌无力	指一种神经与肌肉接头部位传递障碍的自身免疫性疾病，临床特征是局部或全身横纹肌于活动时易于疲劳无力，颅神经眼外肌最易累及，也可涉及呼吸肌、下肢近端肌群乃至全身肌肉。其诊断必须同时满足下列全部条件：（1）经药物、胸腺手术治疗一年以上无法控制病情，丧失正常工作能力（为维持生命必要的日常生活活动，全需他人扶助，系指食物摄取、大小便始末、穿脱衣服、起居、步行、入浴等，皆不能自己为之，需要他人帮助。）；（2）出现因延髓肌受累引起的构音困难、进食呛咳；或由于肌无力累及延髓肌、呼吸肌而致机体呼吸功能不正常的危急状态即肌无力危象；（3）症状缓解、复发及恶化交替出现，临床接受新斯的明等抗胆碱酯酶药物治疗的病史。
32.严重心肌病	指被保人因心肌病导致慢性心功能损害造成永久不可逆性的心功能衰竭。心功能衰竭程度达到纽约心脏病学会的心功能分级标准之心功能IV级，且心功能衰竭状态持续至少180天。被保险人永久不可逆性的体力活动能力受限，且不能从事任何体力活动。
33.严重克罗恩病（Crohns病）	克罗恩病是一种慢性肉芽肿性肠炎，具有特征性的克罗恩病病理组织学变化。诊断必须由病理检查结果证实。被保险人所患的克罗恩病必须已经造成瘘管形成并伴有肠梗阻或肠穿孔。
34.严重溃疡性结肠炎	本合同所保障的溃疡性结肠炎是指伴有致命性电解质紊乱的急性暴发性溃疡性结肠炎，病变累及全结肠，表现为严重的血便和系统性症状体征。溃疡性结肠炎必须根据组织病理学特点诊断，并且被保险人已经接受了结肠切除或回肠造瘘术。
35.植物人状态	植物人状态是指由于严重颅脑外伤造成大脑和/或脑干严重损害导致完全永久性的对自身和环境的意识丧失和中枢神经系统功能丧失，仅残存植物神经功能的疾病状态。对自身和环境的意识丧失的完全永久性指严重颅脑外伤后对自身和环境的意识丧失持续12个月以上。诊断必须明确并且具有严重颅脑外伤和脑损害的证据。
36.严重1型糖尿病	指由于胰岛素分泌绝对不足引起的慢性血糖升高，且已经持续性地依赖外源性胰岛素维持180天以上。须经血胰岛素测定、血C肽测定或尿C肽测定，结果异常，并由内分泌科专科医生明确诊断。并须在本合同有效期内，且已经接受下列治疗：因严重心律失常已经植入了心脏起搏器，或因坏疽需切除至少一个脚趾。
37.系统性红斑狼疮	（并发）系统性红斑狼疮是由多种因素引起，累及多系统的自身免疫性疾病。其特III型或以上狼疮性肾炎点是生成自身抗体对抗多种自身抗原。多见于育龄妇女。本合同所指的系统性红斑狼疮仅限于累及肾脏（经肾脏活检确认的，符合WHO诊断标准定义III型或III型以上狼疮性肾炎）的系统性红斑狼疮。太平乐享无忧终身重大疾病保险，第15页，共24页其他类型的红斑性狼疮，如盘状狼疮、仅累及血液及关节的狼疮不在保障范围取Ｊ澜缥郎组织（WHO）狼疮性肾炎分型：
38.非阿尔茨海默病所致严重痴	指因阿尔茨海默病以外的脑的器质性疾病造成脑功能衰竭导致永久不可呆逆性的严重痴呆，临床表现为明显的认知能力障碍、行为异常和社交能力减退。被保险人自主生活能力完全丧失，无法独立完成六项基本日常生活活动中的三项或三项以上，日常生活必须持续受到他人监护。导致痴呆的疾病必须明确诊断，并且有完整的临床、实验室和影像学检查结果证实。神经官能症,精神疾病及酒精中毒所致脑损害不在保障范围内。
39.严重类风湿性关节炎	指广泛分布的慢性进行性多关节病变，表现为关节严重变形，侵犯至少三个主要关节（腕关节、肘关节、肩关节、踝关节、膝关节、髋关节）或关节组（如手的多个指间、掌指关节，足的多个足趾、跖趾关节等）。类风湿性关节炎须明确诊断，并已达到类风湿性关节炎功能活动分级（注）IV级的永久不可逆性关节功能障碍，且须满足下列全部条件：（1）晨僵；（2）对称性关节炎；（3）类风湿性皮下结节；（4）类风湿因子滴度升高；（5）X线显示严重的关节（软骨和骨）破坏和关节畸形。注：类风湿性关节炎功能活动分级：级：关节功能完整，一般活动无障碍。级：有关节不适或障碍，但尚能完成一半活动。级：功能活动明显受限，但大部分生活可自理。级：生活不能自理或卧床。
40.严重哮喘二十五周岁前理	指一种反复发作的严重支气管阻塞性疾病，经我们认可的专科医生确诊，赔且必须同时符合下列标准：（1）过去两年中曾因哮喘持续状态住院治疗，并提供完整住院记录；（2）因慢性过度换气导致胸廓畸形；（3）在家中需要医生处方的氧气治疗法；（4）持续日常服用口服类固醇激素治疗持续至少六个月。被保险人申请理赔时年龄必须在年满二十五周岁之前。
41.肾髓质囊性病	肾髓质囊性病的诊断须同时符合下列要求：（1）肾髓质有囊肿、肾小管萎缩及间质纤维化等病理改变；（2）肾功能衰竭；（3）诊断须由肾组织活检确定。我们承担本项疾病责任不受本合同责任免除中遗传性疾病，先天性畸形、变形或染色体异常的限制。
42.重症急性坏死性筋膜炎	是一种由细菌侵入皮下组织和筋膜引起的急性坏死性软组织感染，可伴有太平乐享无忧终身重大疾病保险，第16页，共24页毒血症、败血症、中毒性休克、弥漫性血管内凝血及多器官衰竭。必须满足以下所有条件：（1）细菌培养和临床表现符合坏死性筋膜炎诊断标准；（2）病情迅速恶化，有脓毒血症表现；（3）受感染肢体被截肢（自腕关节或踝关节近端）。
43.慢性呼吸功能衰竭终末期肺	指慢性肺部疾病导致永久不可逆性的慢性呼吸功能衰竭，必须由呼吸专科病医生确认并符合下列所有条件：（1）休息时出现呼吸困难；（2）动脉血氧分压（PaO2）50mmHg；（3）动脉血氧饱和度（SaO2）80；（4）因缺氧必须接受持续的输氧治疗。
44.胰腺移植	指因胰腺功能衰竭，已经实施了在全身麻醉下进行的胰腺的异体器官移植手术（供体必须是人体器官）。单纯胰岛移植、部分胰腺组织或细胞的移植不在保障范围内。
45.埃博拉病毒感染	指受埃博拉病毒感染导致出血性发热。埃博拉病必须经国家机关认可的有合法资质的传染病专家确诊，并且埃博拉病毒的存在必须经过实验室检查证实。该病必须从症状开始后30天后持续出现并发症。
46.破裂脑动脉瘤夹闭手术	指因脑动脉瘤破裂造成蛛网膜下腔出血，被保险人实际接受了在全麻下进行的开颅动脉瘤夹闭手术。脑动脉瘤（未破裂）预防性手术、颅骨打孔手术、动脉瘤栓塞手术、血管内手术及其他颅脑手术不在保障范围内。
47.丝虫病所致象皮肿	指因丝虫感染导致淋巴阻塞性出现严重淋巴水肿，达到国际淋巴学会淋巴水肿分期第III期，临床表现为肢体象皮肿，患肢较健肢增粗30以上，日常生活不能自理。
48.急性坏死性胰腺炎开腹手术	指为治疗急性坏死性胰腺炎，实际实施了开腹进行的坏死组织清除术、病灶切除术或胰腺部分切除术。为治疗因酒精中毒引起的急性坏死性胰腺炎的开腹手术不在保障范围内。
49.主动脉夹层血肿	是指主动脉壁在受到某些病理因素的破坏后，高速、高压的主动脉血流将其内膜撕裂，以致主动脉腔内的血流通过主动脉内膜的破裂口进入主动脉内壁而形成血肿。被保险人需通过断层扫描（CT）、核磁共振检查（MRI）、磁共振血管检验法（MRA）或血管扫描等检查，并且实施了胸腹切开的直视主动脉手术。
50.系统性硬皮病	指一种以局限性或弥漫性皮肤增厚和皮肤、血管、内脏器官异常纤维化为特征的结缔组织病。本病须经专科医生明确诊断，并须满足下列至少一项条件：（1）肺脏：肺部病变进而发展为肺间质纤维化和肺动脉高压；（2）心脏：心功能受损达到美国纽约心脏病学会心功能状态分级IV级；（3）肾脏：肾脏受损导致双肾功能慢性不可逆衰竭，达到尿毒症期。
51.原发性硬化性胆管炎	指一种胆汁淤积综合征，其特征是肝内、肝外胆道因纤维化性炎症逐渐狭窄，并最终导致完全阻塞而发展为肝硬化。本病须经内镜逆行胰胆管造影等影像学检查证实，并须满足下列全部条件：（1）总胆红素和直接胆红素同时升高，血清ALP200U/L；（2）持续性黄疸病史；（3）出现胆汁性肝硬化或门脉高压。太平乐享无忧终身重大疾病保险，第17页，共24页因肿瘤或胆管损伤等继发性的硬化性胆管炎不在保障范围内。
52.经输血导致的HIV感染	指被保险人感染上人类免疫缺陷病毒（HIV）并且满足下列全部条件：（1）被保险人等待期后因输血而感染HIV；（2）提供输血治疗的输血中心或医院出具该项输血感染属医疗责任事故的报告，或者法院终审裁定为医疗责任并且不准上诉；（3）受感染的被保险人不是血友病患者。任何因其他传播方式（包括：性传播或静脉注射毒品）导致的HIV感染不在保障范围内。我们保留获得使用被保险人的所有血液样本的权利，并对这些样本进行独立检验。我们承担本项疾病责任不受本合同责任免除中被保险人感染艾滋病病毒或患艾滋病的限制。
